{
    "$schema": "./schemas/feature.schema.json",
    "version": "1.0.0",
    "updatedAt": "2024-01-16",
    "description": "GridKit Feature Registry - All planned and implemented features",
    "features": [
        {
            "id": "data-management",
            "name": "Data Management",
            "description": "Data providers, optimization, and pagination systems",
            "category": "core",
            "priority": "P0",
            "status": "planned",
            "subFeatures": [
                {
                    "id": "data-providers",
                    "name": "Data Providers",
                    "description": "Various data source implementations",
                    "items": [
                        {
                            "id": "static-provider",
                            "name": "Static Data Provider",
                            "description": "Load data from arrays/JSON in memory",
                            "priority": "P0"
                        },
                        {
                            "id": "rest-provider",
                            "name": "REST API Provider",
                            "description": "Load data from REST APIs with HTTP",
                            "priority": "P0"
                        },
                        {
                            "id": "graphql-provider",
                            "name": "GraphQL Provider",
                            "description": "Load data from GraphQL endpoints",
                            "priority": "P1"
                        },
                        {
                            "id": "websocket-provider",
                            "name": "WebSocket/SSE Provider",
                            "description": "Real-time data streaming",
                            "priority": "P2"
                        },
                        {
                            "id": "indexeddb-provider",
                            "name": "IndexedDB Provider",
                            "description": "Offline data storage and sync",
                            "priority": "P2"
                        }
                    ]
                },
                {
                    "id": "data-optimization",
                    "name": "Data Optimization",
                    "description": "Performance optimization techniques",
                    "items": [
                        {
                            "id": "virtual-scrolling",
                            "name": "Virtual Scrolling",
                            "description": "Render only visible rows for 100k+ datasets",
                            "priority": "P0"
                        },
                        {
                            "id": "incremental-loading",
                            "name": "Incremental Loading",
                            "description": "Lazy load data as needed",
                            "priority": "P1"
                        },
                        {
                            "id": "caching",
                            "name": "Caching & Invalidation",
                            "description": "Smart data caching strategies",
                            "priority": "P1"
                        }
                    ]
                },
                {
                    "id": "pagination",
                    "name": "Pagination",
                    "description": "Data pagination systems",
                    "items": [
                        {
                            "id": "client-pagination",
                            "name": "Client-side Pagination",
                            "description": "Paginate data in browser memory",
                            "priority": "P0"
                        },
                        {
                            "id": "server-pagination",
                            "name": "Server-side Pagination",
                            "description": "Paginate data on server",
                            "priority": "P0"
                        },
                        {
                            "id": "infinite-scroll",
                            "name": "Infinite Scroll",
                            "description": "Load more data on scroll",
                            "priority": "P1"
                        }
                    ]
                }
            ]
        },
        {
            "id": "layout-system",
            "name": "Layout System",
            "description": "Table layout persistence and management",
            "category": "core",
            "priority": "P0",
            "status": "planned",
            "subFeatures": [
                {
                    "id": "layout-providers",
                    "name": "Layout Providers",
                    "description": "Storage backends for layouts",
                    "items": [
                        {
                            "id": "localstorage-provider",
                            "name": "LocalStorage Provider",
                            "description": "Store layouts in browser localStorage",
                            "priority": "P0"
                        },
                        {
                            "id": "server-provider",
                            "name": "Server Provider",
                            "description": "Store layouts on backend server",
                            "priority": "P1"
                        }
                    ]
                },
                {
                    "id": "layout-management",
                    "name": "Layout Management",
                    "description": "Create, save, load layouts",
                    "items": [
                        {
                            "id": "named-layouts",
                            "name": "Named Layouts",
                            "description": "Save/load named layout configurations",
                            "priority": "P0"
                        },
                        {
                            "id": "layout-import-export",
                            "name": "Import/Export Layouts",
                            "description": "Share layouts via JSON/YAML",
                            "priority": "P1"
                        }
                    ]
                }
            ]
        },
        {
            "id": "columns-system",
            "name": "Columns System",
            "description": "Column management, types, and rendering",
            "category": "core",
            "priority": "P0",
            "status": "in-progress",
            "implementedParts": [
                "core-types",
                "column-interfaces"
            ],
            "subFeatures": [
                {
                    "id": "column-management",
                    "name": "Column Management",
                    "description": "Column manipulation operations",
                    "items": [
                        {
                            "id": "dynamic-columns",
                            "name": "Dynamic Columns",
                            "description": "Add/remove columns at runtime",
                            "priority": "P0"
                        },
                        {
                            "id": "show-hide-columns",
                            "name": "Show/Hide Columns",
                            "description": "Toggle column visibility",
                            "priority": "P0"
                        },
                        {
                            "id": "column-reordering",
                            "name": "Column Reordering",
                            "description": "Drag-and-drop column ordering",
                            "priority": "P0"
                        },
                        {
                            "id": "column-resizing",
                            "name": "Column Resizing",
                            "description": "Resize columns with mouse",
                            "priority": "P0"
                        }
                    ]
                },
                {
                    "id": "column-types",
                    "name": "Column Types",
                    "description": "Different data type renderers",
                    "items": [
                        {
                            "id": "text-column",
                            "name": "Text Column",
                            "description": "Basic text rendering",
                            "priority": "P0"
                        },
                        {
                            "id": "number-column",
                            "name": "Number Column",
                            "description": "Numeric formatting",
                            "priority": "P0"
                        },
                        {
                            "id": "date-column",
                            "name": "Date/Time Column",
                            "description": "Date formatting and pickers",
                            "priority": "P0"
                        },
                        {
                            "id": "boolean-column",
                            "name": "Boolean Column",
                            "description": "Checkbox renderer",
                            "priority": "P0"
                        }
                    ]
                },
                {
                    "id": "column-rendering",
                    "name": "Column Rendering",
                    "description": "Cell and header renderers",
                    "items": [
                        {
                            "id": "custom-renderers",
                            "name": "Custom Renderers",
                            "description": "Custom cell/header components",
                            "priority": "P0"
                        },